{
  "test_id": "exec-ui-002",
  "name": "Checkbox captures selected options",
  "category": "execution",
  "tags": ["user-interaction", "checkbox", "output-capture"],
  "workflow": {
    "local_id": "wf-ui-002",
    "oid": "wf-ui-002-oid",
    "version": "1.0.0",
    "last_modified_date": "2026-03-04T00:00:00Z",
    "schemaVersion": "4.0",
    "value_property_specifications": [
      {
        "name": "Choices",
        "entries": [
          { "name": "Value", "value": "" }
        ]
      }
    ],
    "steps": [
      {
        "local_id": "start",
        "oid": "step-start",
        "version": "1.0.0",
        "last_modified_date": "2026-03-04T00:00:00Z",
        "step_type": "START",
        "position": { "x": 100, "y": 100 }
      },
      {
        "local_id": "ui",
        "oid": "step-ui",
        "version": "1.0.0",
        "last_modified_date": "2026-03-04T00:00:00Z",
        "step_type": "USER_INTERACTION",
        "position": { "x": 100, "y": 200 },
        "form_layout_config": [
          {
            "deviceType": "phone",
            "canvasWidth": 390,
            "canvasHeight": 844,
            "elements": [
              {
                "type": "checkbox",
                "x": 20,
                "y": 100,
                "width": 350,
                "height": 120,
                "label": "Select Options",
                "fieldName": "choices",
                "options": ["Option A", "Option B", "Option C"],
                "outputParameter": "Choices.Value"
              }
            ]
          }
        ]
      },
      {
        "local_id": "end",
        "oid": "step-end",
        "version": "1.0.0",
        "last_modified_date": "2026-03-04T00:00:00Z",
        "step_type": "END",
        "position": { "x": 100, "y": 300 }
      }
    ],
    "connections": [
      {
        "from_step_id": "step-start",
        "to_step_id": "step-ui"
      },
      {
        "from_step_id": "step-ui",
        "to_step_id": "step-end"
      }
    ]
  },
  "user_actions": [
    {
      "step_oid": "step-ui",
      "action": "submit",
      "form_values": { "choices": ["Option A", "Option C"] }
    }
  ],
  "expected": {
    "valid": true,
    "execution_trace": [
      { "step_oid": "step-start", "state": "COMPLETED", "order": 1 },
      { "step_oid": "step-ui", "state": "EXECUTING", "order": 2 },
      { "step_oid": "step-ui", "state": "COMPLETED", "order": 3, "after_action": 0 },
      { "step_oid": "step-end", "state": "COMPLETED", "order": 4 }
    ],
    "final_properties": {
      "Choices.Value": "[\"Option A\",\"Option C\"]"
    },
    "workflow_state": "COMPLETED"
  }
}
