{
  "test_id": "val-struct-006",
  "name": "Step missing required ManagedElement field",
  "category": "validation",
  "tags": ["structural", "invalid", "missing-field"],
  "workflow": {
    "local_id": "wf-006",
    "oid": "wf-006-oid",
    "version": "1.0.0",
    "last_modified_date": "2026-03-04T00:00:00Z",
    "schemaVersion": "4.0",
    "steps": [
      {
        "local_id": "start",
        "oid": "step-start-oid",
        "version": "1.0.0",
        "last_modified_date": "2026-03-04T00:00:00Z",
        "step_type": "START",
        "position": { "x": 0, "y": 0 }
      },
      {
        "local_id": "end",
        "version": "1.0.0",
        "last_modified_date": "2026-03-04T00:00:00Z",
        "step_type": "END",
        "position": { "x": 200, "y": 0 }
      }
    ],
    "connections": [
      {
        "from_step_id": "step-start-oid",
        "to_step_id": "step-end-oid"
      }
    ]
  },
  "expected": {
    "valid": false,
    "error_code": "MISSING_REQUIRED_FIELD"
  }
}
