{
  "test_id": "exec-parallel-005",
  "name": "Parallel with mixed auto and UI branches",
  "category": "execution",
  "tags": ["parallel", "mixed"],
  "workflow": {
    "local_id": "wf-parallel-005",
    "oid": "wf-parallel-005-oid",
    "version": "1.0.0",
    "last_modified_date": "2026-03-04T00:00:00Z",
    "schemaVersion": "4.0",
    "steps": [
      {
        "local_id": "start",
        "oid": "step-start",
        "version": "1.0.0",
        "last_modified_date": "2026-03-04T00:00:00Z",
        "step_type": "START",
        "position": { "x": 200, "y": 100 }
      },
      {
        "local_id": "parallel",
        "oid": "step-parallel",
        "version": "1.0.0",
        "last_modified_date": "2026-03-04T00:00:00Z",
        "step_type": "PARALLEL",
        "position": { "x": 200, "y": 200 }
      },
      {
        "local_id": "script",
        "oid": "step-script",
        "version": "1.0.0",
        "last_modified_date": "2026-03-04T00:00:00Z",
        "step_type": "SCRIPT",
        "position": { "x": 100, "y": 300 },
        "script_config": {
          "language": "javascript",
          "source": "// Auto-completing script step"
        }
      },
      {
        "local_id": "ui",
        "oid": "step-ui",
        "version": "1.0.0",
        "last_modified_date": "2026-03-04T00:00:00Z",
        "step_type": "USER_INTERACTION",
        "position": { "x": 300, "y": 300 },
        "form_layout_config": [
          {
            "deviceType": "phone",
            "canvasWidth": 390,
            "canvasHeight": 844,
            "elements": [
              {
                "type": "textInput",
                "x": 10,
                "y": 10,
                "width": 370,
                "height": 50,
                "label": "Answer",
                "placeholder": "Enter your answer",
                "fieldName": "answer",
                "required": true,
                "outputParameter": "UserAnswer.Value"
              },
              {
                "type": "button",
                "x": 10,
                "y": 80,
                "width": 370,
                "height": 50,
                "label": "Submit",
                "outputValue": "done"
              }
            ]
          }
        ]
      },
      {
        "local_id": "wait-all",
        "oid": "step-wait-all",
        "version": "1.0.0",
        "last_modified_date": "2026-03-04T00:00:00Z",
        "step_type": "WAIT ALL",
        "position": { "x": 200, "y": 400 }
      },
      {
        "local_id": "end",
        "oid": "step-end",
        "version": "1.0.0",
        "last_modified_date": "2026-03-04T00:00:00Z",
        "step_type": "END",
        "position": { "x": 200, "y": 500 }
      }
    ],
    "connections": [
      { "from_step_id": "step-start", "to_step_id": "step-parallel" },
      { "from_step_id": "step-parallel", "to_step_id": "step-script" },
      { "from_step_id": "step-parallel", "to_step_id": "step-ui" },
      { "from_step_id": "step-script", "to_step_id": "step-wait-all" },
      { "from_step_id": "step-ui", "to_step_id": "step-wait-all" },
      { "from_step_id": "step-wait-all", "to_step_id": "step-end" }
    ]
  },
  "user_actions": [
    {
      "step_oid": "step-ui",
      "action": "submit",
      "form_values": { "answer": "done" }
    }
  ],
  "expected": {
    "valid": true,
    "execution_trace": [
      { "step_oid": "step-start", "state": "COMPLETED", "order": 1 },
      { "step_oid": "step-parallel", "state": "COMPLETED", "order": 2 },
      { "step_oid": "step-script", "state": "COMPLETED", "order": 3 },
      { "step_oid": "step-ui", "state": "EXECUTING", "order": 4 },
      { "step_oid": "step-wait-all", "state": "EXECUTING", "order": 5 },
      { "step_oid": "step-ui", "state": "COMPLETED", "order": 6, "after_action": 0 },
      { "step_oid": "step-wait-all", "state": "COMPLETED", "order": 7 },
      { "step_oid": "step-end", "state": "COMPLETED", "order": 8 }
    ],
    "final_properties": {
      "UserAnswer.Value": "done"
    },
    "workflow_state": "COMPLETED"
  }
}
