{
  "test_id": "val-sem-008",
  "name": "Duplicate step OID",
  "category": "validation",
  "tags": ["semantic", "invalid", "duplicate"],
  "workflow": {
    "local_id": "duplicate-step-oid",
    "oid": "8000000000000008",
    "version": "1.0.0",
    "last_modified_date": "2026-03-04T00:00:00Z",
    "schemaVersion": "4.0",
    "steps": [
      {
        "local_id": "start",
        "oid": "step-start",
        "version": "1.0.0",
        "last_modified_date": "2026-03-04T00:00:00Z",
        "step_type": "START",
        "position": { "x": 200, "y": 50 }
      },
      {
        "local_id": "ui-first",
        "oid": "step-ui",
        "version": "1.0.0",
        "last_modified_date": "2026-03-04T00:00:00Z",
        "step_type": "USER_INTERACTION",
        "position": { "x": 200, "y": 200 },
        "form_layout_config": [
          {
            "deviceType": "phone",
            "canvasWidth": 390,
            "canvasHeight": 844,
            "elements": [
              {
                "type": "button",
                "x": 20,
                "y": 40,
                "width": 350,
                "height": 44
              }
            ]
          }
        ]
      },
      {
        "local_id": "ui-second",
        "oid": "step-ui",
        "version": "1.0.0",
        "last_modified_date": "2026-03-04T00:00:00Z",
        "step_type": "USER_INTERACTION",
        "position": { "x": 200, "y": 350 },
        "form_layout_config": [
          {
            "deviceType": "phone",
            "canvasWidth": 390,
            "canvasHeight": 844,
            "elements": [
              {
                "type": "button",
                "x": 20,
                "y": 40,
                "width": 350,
                "height": 44
              }
            ]
          }
        ]
      },
      {
        "local_id": "end",
        "oid": "step-end",
        "version": "1.0.0",
        "last_modified_date": "2026-03-04T00:00:00Z",
        "step_type": "END",
        "position": { "x": 200, "y": 500 }
      }
    ],
    "connections": [
      {
        "from_step_id": "step-start",
        "to_step_id": "step-ui"
      },
      {
        "from_step_id": "step-ui",
        "to_step_id": "step-end"
      }
    ]
  },
  "expected": {
    "valid": false,
    "error_code": "DUPLICATE_STEP_OID"
  }
}