{
  "test_id": "val-try-catch-001",
  "name": "Cross-network edge from main flow into catch-network interior",
  "category": "validation",
  "tags": ["try-catch", "validation"],
  "workflow": {
    "local_id": "wf",
    "oid": "wf-1",
    "version": "1.0.0",
    "last_modified_date": "2026-05-31T12:00:00.000Z",
    "schemaVersion": "4.0",
    "environment_specifications": [
      {
        "local_id": "env",
        "oid": "env-1",
        "version": "1.0.0",
        "last_modified_date": "2026-05-31T12:00:00.000Z",
        "included_actions": [{ "action_oid": "act-1", "action_name": "DoThing", "action_library": "lib-1" }]
      }
    ],
    "steps": [
      { "local_id": "Start", "oid": "s1", "version": "1.0.0", "last_modified_date": "2026-05-31T12:00:00.000Z", "step_type": "START" },
      { "local_id": "Action", "oid": "s2", "version": "1.0.0", "last_modified_date": "2026-05-31T12:00:00.000Z", "step_type": "ACTION PROXY", "action_proxy_config": { "action_oid": "act-1", "environment_oid": "env-1" }, "try_specifications": [{ "mode": "ERROR", "catch_id": "C1" }] },
      { "local_id": "End", "oid": "s3", "version": "1.0.0", "last_modified_date": "2026-05-31T12:00:00.000Z", "step_type": "END" },
      { "local_id": "Catch", "oid": "c1", "version": "1.0.0", "last_modified_date": "2026-05-31T12:00:00.000Z", "step_type": "CATCH", "catch_id": "C1" },
      { "local_id": "Mid", "oid": "mid1", "version": "1.0.0", "last_modified_date": "2026-05-31T12:00:00.000Z", "step_type": "USER_INTERACTION" },
      { "local_id": "Ret", "oid": "r1", "version": "1.0.0", "last_modified_date": "2026-05-31T12:00:00.000Z", "step_type": "RETURN", "return_config": { "command": "ABANDON" } }
    ],
    "connections": [
      { "from_step_id": "s1", "to_step_id": "s2" },
      { "from_step_id": "s2", "to_step_id": "s3" },
      { "from_step_id": "c1", "to_step_id": "mid1" },
      { "from_step_id": "mid1", "to_step_id": "r1" },
      { "from_step_id": "s2", "to_step_id": "mid1" }
    ]
  },
  "expected": {
    "valid": false,
    "error_code": "CROSS_NETWORK_EDGE"
  }
}
